{
  "baseline": {
    "legacy_python": "docs/_extras/methods_bibliography.py",
    "legacy_python_sha256": "140554600e9d2f835e1d11a383d9d389c730d86c5205a5f742ea8465824e6d30",
    "source_revision": "2a2dee5f8742a051eea23c1c7f545989401780b9"
  },
  "catalog_version": 1,
  "parity_provenance": [
    {
      "path": "parity/REFERENCES.md",
      "sha256": "52baac5aeedd0b3e6f58992e9d59ed2456442bfc249b7f9d5cd8e2235db20beb"
    },
    {
      "path": "benchmarks/parity_timing/truth_sources.lock.json",
      "sha256": "a4955a2a577ac2a9c046fd874b3623540a6e925900084ec8fd82a52832836f1b"
    }
  ],
  "publications": [
    {
      "authors": null,
      "bibtex": null,
      "doi": null,
      "id": "legacy-aom_pls",
      "journal": null,
      "legacy_citation": "Beurier, G., Reiter, R., Noûs, C., Rouan, L. & Cornet, D. (2026). *Reframing preprocessing selection as model-internal calibration in near-infrared spectroscopy: a large-scale benchmark of operator-adaptive PLS and Ridge models*. arXiv:2605.13587. https://arxiv.org/abs/2605.13587.",
      "method_key": "aom_pls",
      "method_title": "AOM-PLS (global adaptive operator selection)",
      "provenance": {
        "fields_status": "unstructured_legacy",
        "missing_fields": [
          "authors",
          "title",
          "year",
          "journal",
          "doi",
          "url",
          "bibtex"
        ],
        "source": "docs/_extras/methods_bibliography.py:BIBLIOGRAPHY.aom_pls.paper"
      },
      "title": null,
      "url": null,
      "year": null
    },
    {
      "authors": null,
      "bibtex": null,
      "doi": null,
      "id": "legacy-aom_preprocess",
      "journal": null,
      "legacy_citation": "Beurier, G., Reiter, R., Noûs, C., Rouan, L. & Cornet, D. (2026). *Reframing preprocessing selection as model-internal calibration in near-infrared spectroscopy: a large-scale benchmark of operator-adaptive PLS and Ridge models*. arXiv:2605.13587. https://arxiv.org/abs/2605.13587 — introduces operator-adaptive PLS (AOM-PLS / POP-PLS) and the bench against 50+ NIRS datasets that the git-pinned oracle `nirs4all.operators.models.sklearn.aom_pls` is calibrated against.",
      "method_key": "aom_preprocess",
      "method_title": "AOM (Adaptive Operator Mixture) preprocessing bank",
      "provenance": {
        "fields_status": "unstructured_legacy",
        "missing_fields": [
          "authors",
          "title",
          "year",
          "journal",
          "doi",
          "url",
          "bibtex"
        ],
        "source": "docs/_extras/methods_bibliography.py:BIBLIOGRAPHY.aom_preprocess.paper"
      },
      "title": null,
      "url": null,
      "year": null
    },
    {
      "authors": null,
      "bibtex": null,
      "doi": null,
      "id": "legacy-approximate_press",
      "journal": null,
      "legacy_citation": "Allen, D. M. (1974). *The relationship between variable selection and data augmentation and a method for prediction*. Technometrics 16(1), 125–127.",
      "method_key": "approximate_press",
      "method_title": "Approximate PRESS (leave-one-out by hat-matrix)",
      "provenance": {
        "fields_status": "unstructured_legacy",
        "missing_fields": [
          "authors",
          "title",
          "year",
          "journal",
          "doi",
          "url",
          "bibtex"
        ],
        "source": "docs/_extras/methods_bibliography.py:BIBLIOGRAPHY.approximate_press.paper"
      },
      "title": null,
      "url": null,
      "year": null
    },
    {
      "authors": null,
      "bibtex": null,
      "doi": null,
      "id": "legacy-bagging_pls",
      "journal": null,
      "legacy_citation": "Breiman, L. (1996). *Bagging predictors*. Machine Learning 24(2), 123–140. — adapted for PLS by various chemometric authors.",
      "method_key": "bagging_pls",
      "method_title": "Bagging PLS",
      "provenance": {
        "fields_status": "unstructured_legacy",
        "missing_fields": [
          "authors",
          "title",
          "year",
          "journal",
          "doi",
          "url",
          "bibtex"
        ],
        "source": "docs/_extras/methods_bibliography.py:BIBLIOGRAPHY.bagging_pls.paper"
      },
      "title": null,
      "url": null,
      "year": null
    },
    {
      "authors": null,
      "bibtex": null,
      "doi": null,
      "id": "legacy-bipls_select",
      "journal": null,
      "legacy_citation": "Leardi, R. & Nørgaard, L. (2004). *Sequential application of backward interval partial least squares and genetic algorithms for the selection of relevant spectral regions*. Journal of Chemometrics 18(11), 486–497.",
      "method_key": "bipls_select",
      "method_title": "biPLS — Backward Interval PLS",
      "provenance": {
        "fields_status": "unstructured_legacy",
        "missing_fields": [
          "authors",
          "title",
          "year",
          "journal",
          "doi",
          "url",
          "bibtex"
        ],
        "source": "docs/_extras/methods_bibliography.py:BIBLIOGRAPHY.bipls_select.paper"
      },
      "title": null,
      "url": null,
      "year": null
    },
    {
      "authors": null,
      "bibtex": null,
      "doi": null,
      "id": "legacy-boosting_pls",
      "journal": null,
      "legacy_citation": "Friedman, J. H. (2001). *Greedy function approximation: a gradient boosting machine*. Annals of Statistics 29(5), 1189–1232. — adapted for PLS as a base learner.",
      "method_key": "boosting_pls",
      "method_title": "Boosting PLS",
      "provenance": {
        "fields_status": "unstructured_legacy",
        "missing_fields": [
          "authors",
          "title",
          "year",
          "journal",
          "doi",
          "url",
          "bibtex"
        ],
        "source": "docs/_extras/methods_bibliography.py:BIBLIOGRAPHY.boosting_pls.paper"
      },
      "title": null,
      "url": null,
      "year": null
    },
    {
      "authors": null,
      "bibtex": null,
      "doi": null,
      "id": "legacy-bve_select",
      "journal": null,
      "legacy_citation": "Forina, M., Casolino, M. C. & Pizarro Millán, C. (2004). *Iterative predictor weighting (IPW) PLS: a technique for the elimination of useless predictors in regression problems*. Journal of Chemometrics 18(2), 105–112 (§2).",
      "method_key": "bve_select",
      "method_title": "BVE — Backward Variable Elimination",
      "provenance": {
        "fields_status": "unstructured_legacy",
        "missing_fields": [
          "authors",
          "title",
          "year",
          "journal",
          "doi",
          "url",
          "bibtex"
        ],
        "source": "docs/_extras/methods_bibliography.py:BIBLIOGRAPHY.bve_select.paper"
      },
      "title": null,
      "url": null,
      "year": null
    },
    {
      "authors": null,
      "bibtex": null,
      "doi": null,
      "id": "legacy-cars_select",
      "journal": null,
      "legacy_citation": "Li, H., Liang, Y., Xu, Q. & Cao, D. (2009). *Key wavelengths screening using competitive adaptive reweighted sampling method for multivariate calibration*. Analytica Chimica Acta 648(1), 77–84.",
      "method_key": "cars_select",
      "method_title": "CARS — Competitive Adaptive Reweighted Sampling",
      "provenance": {
        "fields_status": "unstructured_legacy",
        "missing_fields": [
          "authors",
          "title",
          "year",
          "journal",
          "doi",
          "url",
          "bibtex"
        ],
        "source": "docs/_extras/methods_bibliography.py:BIBLIOGRAPHY.cars_select.paper"
      },
      "title": null,
      "url": null,
      "year": null
    },
    {
      "authors": null,
      "bibtex": null,
      "doi": null,
      "id": "legacy-continuum_regression",
      "journal": null,
      "legacy_citation": "Stone, M. & Brooks, R. J. (1990). *Continuum regression: cross-validated sequentially constructed prediction embracing ordinary least squares, partial least squares and principal components regression*. JRSS B 52(2), 237–269.",
      "method_key": "continuum_regression",
      "method_title": "Continuum Regression (Stone & Brooks 1990)",
      "provenance": {
        "fields_status": "unstructured_legacy",
        "missing_fields": [
          "authors",
          "title",
          "year",
          "journal",
          "doi",
          "url",
          "bibtex"
        ],
        "source": "docs/_extras/methods_bibliography.py:BIBLIOGRAPHY.continuum_regression.paper"
      },
      "title": null,
      "url": null,
      "year": null
    },
    {
      "authors": null,
      "bibtex": null,
      "doi": null,
      "id": "legacy-cppls",
      "journal": null,
      "legacy_citation": "Indahl, U. G. (2005). *A twist to partial least squares regression*. Journal of Chemometrics 19(1), 32–44.",
      "method_key": "cppls",
      "method_title": "Powered PLS (Indahl 2005)",
      "provenance": {
        "fields_status": "unstructured_legacy",
        "missing_fields": [
          "authors",
          "title",
          "year",
          "journal",
          "doi",
          "url",
          "bibtex"
        ],
        "source": "docs/_extras/methods_bibliography.py:BIBLIOGRAPHY.cppls.paper"
      },
      "title": null,
      "url": null,
      "year": null
    },
    {
      "authors": null,
      "bibtex": null,
      "doi": null,
      "id": "legacy-di_pls",
      "journal": null,
      "legacy_citation": "Nikzad-Langerodi, R., Zellinger, W., Saminger-Platz, S. & Moser, B. A. (2018). *Domain-invariant partial-least-squares regression*. Analytical Chemistry 90(11), 6693–6701.",
      "method_key": "di_pls",
      "method_title": "Domain-Invariant PLS (di-PLS)",
      "provenance": {
        "fields_status": "unstructured_legacy",
        "missing_fields": [
          "authors",
          "title",
          "year",
          "journal",
          "doi",
          "url",
          "bibtex"
        ],